[{"canonical_name":"Flexential Allentown data center","census_region":"Northeast","county_name":"Lehigh County","created_at":"2026-09-01T02:30:00Z","facility_id":"fac_im3_building_00296374269","initial_tranche_rank":41,"lifecycle_status":"unknown","national_priority_id":"lnp_im3_8ac74fba44ff0039449d","national_rank":426,"operator_canonical_name":"Flexential","operator_id":"opr_im3_8df677c4e180e025074b","primary_county_fips":"42077","prior_pilot_outcome":"not_reviewed","priority_score":79.95,"priority_tier":"national_high","queue_status":"initial_tranche","record_status":"active","region_rank":18,"research_archetype":"named_operator_building","schema_version":"1.0.0","score_components":{"building_footprint":15,"county_density":0.1058,"non_campus_specificity":10,"operator_link":15,"source_name_specificity":20,"source_quality":15.0,"source_reference":0,"state_coverage_need":4.8415},"selection_reasons":["Source provides a facility name suitable for exact-identity research.","A source-backed normalized operator relationship is available.","Mapped building geometry supports address, parcel, assessor, and permit matching."],"source_layer":"building","state_abbr":"PA","suggested_source_types":["operator_release","planning_record","permit_record","assessor_record","utility_filing"],"target_attributes":["facility.current_status","facility.facility_type","event.announced","event.construction_started","event.operational","event.expansion_operational","event.closed","operator_relationship.roles","observation.capacity_mw","observation.floor_area_sqft"],"updated_at":"2026-09-01T02:30:00Z"},{"canonical_name":"Comcast","census_region":"Midwest","county_name":"Wayne County","created_at":"2026-09-01T02:30:00Z","facility_id":"fac_im3_building_00812630939","initial_tranche_rank":42,"lifecycle_status":"unknown","national_priority_id":"lnp_im3_1b9a9ced8575166d9415","national_rank":410,"operator_canonical_name":"Comcast","operator_id":"opr_im3_4ad259ee020949994159","primary_county_fips":"26163","prior_pilot_outcome":"not_reviewed","priority_score":80.04,"priority_tier":"national_high","queue_status":"initial_tranche","record_status":"active","region_rank":76,"research_archetype":"named_operator_building","schema_version":"1.0.0","score_components":{"building_footprint":15,"county_density":0.2116,"non_campus_specificity":10,"operator_link":15,"source_name_specificity":20,"source_quality":15.0,"source_reference":0,"state_coverage_need":4.8239},"selection_reasons":["Source provides a facility name suitable for exact-identity research.","A source-backed normalized operator relationship is available.","Mapped building geometry supports address, parcel, assessor, and permit matching."],"source_layer":"building","state_abbr":"MI","suggested_source_types":["operator_release","planning_record","permit_record","assessor_record","utility_filing"],"target_attributes":["facility.current_status","facility.facility_type","event.announced","event.construction_started","event.operational","event.expansion_operational","event.closed","operator_relationship.roles","observation.capacity_mw","observation.floor_area_sqft"],"updated_at":"2026-09-01T02:30:00Z"},{"canonical_name":"Flexential Atlanta - Alpharetta Data Center","census_region":"South","county_name":"Fulton County","created_at":"2026-09-01T02:30:00Z","facility_id":"fac_im3_building_00039083797","initial_tranche_rank":43,"lifecycle_status":"unknown","national_priority_id":"lnp_im3_ebaf0a3134d7b28ac14c","national_rank":359,"operator_canonical_name":"Flexential","operator_id":"opr_im3_8df677c4e180e025074b","primary_county_fips":"13121","prior_pilot_outcome":"not_reviewed","priority_score":80.16,"priority_tier":"national_high","queue_status":"initial_tranche","record_status":"active","region_rank":195,"research_archetype":"named_operator_building","schema_version":"1.0.0","score_components":{"building_footprint":15,"county_density":0.6878,"non_campus_specificity":10,"operator_link":15,"source_name_specificity":20,"source_quality":15.0,"source_reference":0,"state_coverage_need":4.4718},"selection_reasons":["Source provides a facility name suitable for exact-identity research.","A source-backed normalized operator relationship is available.","Mapped building geometry supports address, parcel, assessor, and permit matching."],"source_layer":"building","state_abbr":"GA","suggested_source_types":["operator_release","planning_record","permit_record","assessor_record","utility_filing"],"target_attributes":["facility.current_status","facility.facility_type","event.announced","event.construction_started","event.operational","event.expansion_operational","event.closed","operator_relationship.roles","observation.capacity_mw","observation.floor_area_sqft"],"updated_at":"2026-09-01T02:30:00Z"},{"canonical_name":"Switch Las Vegas 7","census_region":"West","county_name":"Clark County","created_at":"2026-09-01T02:30:00Z","facility_id":"fac_im3_building_00172739953","initial_tranche_rank":44,"lifecycle_status":"unknown","national_priority_id":"lnp_im3_ec112d3d358d4416b201","national_rank":342,"operator_canonical_name":"Switch","operator_id":"opr_im3_78b49fb2cc2d2ed6c1bb","primary_county_fips":"32003","prior_pilot_outcome":"not_reviewed","priority_score":80.44,"priority_tier":"national_high","queue_status":"initial_tranche","record_status":"active","region_rank":103,"research_archetype":"named_operator_building","schema_version":"1.0.0","score_components":{"building_footprint":15,"county_density":1.0582,"non_campus_specificity":10,"operator_link":15,"source_name_specificity":20,"source_quality":15.0,"source_reference":0,"state_coverage_need":4.3838},"selection_reasons":["Source provides a facility name suitable for exact-identity research.","A source-backed normalized operator relationship is available.","Mapped building geometry supports address, parcel, assessor, and permit matching."],"source_layer":"building","state_abbr":"NV","suggested_source_types":["operator_release","planning_record","permit_record","assessor_record","utility_filing"],"target_attributes":["facility.current_status","facility.facility_type","event.announced","event.construction_started","event.operational","event.expansion_operational","event.closed","operator_relationship.roles","observation.capacity_mw","observation.floor_area_sqft"],"updated_at":"2026-09-01T02:30:00Z"},{"canonical_name":"Bloomberg Data Center","census_region":"Northeast","county_name":"Rockland County","created_at":"2026-09-01T02:30:00Z","facility_id":"fac_im3_building_01238955720","initial_tranche_rank":45,"lifecycle_status":"unknown","national_priority_id":"lnp_im3_deef06bfff98126f0f34","national_rank":469,"operator_canonical_name":"Bloomberg","operator_id":"opr_im3_0fb9765e58d296e5762b","primary_county_fips":"36087","prior_pilot_outcome":"not_reviewed","priority_score":79.86,"priority_tier":"national_high","queue_status":"initial_tranche","record_status":"active","region_rank":27,"research_archetype":"named_operator_building","schema_version":"1.0.0","score_components":{"building_footprint":15,"county_density":0.2116,"non_campus_specificity":10,"operator_link":15,"source_name_specificity":20,"source_quality":15.0,"source_reference":0,"state_coverage_need":4.6479},"selection_reasons":["Source provides a facility name suitable for exact-identity research.","A source-backed normalized operator relationship is available.","Mapped building geometry supports address, parcel, assessor, and permit matching."],"source_layer":"building","state_abbr":"NY","suggested_source_types":["operator_release","planning_record","permit_record","assessor_record","utility_filing"],"target_attributes":["facility.current_status","facility.facility_type","event.announced","event.construction_started","event.operational","event.expansion_operational","event.closed","operator_relationship.roles","observation.capacity_mw","observation.floor_area_sqft"],"updated_at":"2026-09-01T02:30:00Z"},{"canonical_name":"IU Data Center","census_region":"Midwest","county_name":"Monroe County","created_at":"2026-09-01T02:30:00Z","facility_id":"fac_im3_building_00203432103","initial_tranche_rank":46,"lifecycle_status":"unknown","national_priority_id":"lnp_im3_f79ea207492ca1ea7b27","national_rank":423,"operator_canonical_name":"Indiana University","operator_id":"opr_im3_4c6b8eaa9cee97d792f2","primary_county_fips":"18105","prior_pilot_outcome":"not_reviewed","priority_score":79.96,"priority_tier":"national_high","queue_status":"initial_tranche","record_status":"active","region_rank":77,"research_archetype":"named_operator_building","schema_version":"1.0.0","score_components":{"building_footprint":15,"county_density":0.0529,"non_campus_specificity":10,"operator_link":15,"source_name_specificity":20,"source_quality":15.0,"source_reference":0,"state_coverage_need":4.912},"selection_reasons":["Source provides a facility name suitable for exact-identity research.","A source-backed normalized operator relationship is available.","Mapped building geometry supports address, parcel, assessor, and permit matching."],"source_layer":"building","state_abbr":"IN","suggested_source_types":["operator_release","planning_record","permit_record","assessor_record","utility_filing"],"target_attributes":["facility.current_status","facility.facility_type","event.announced","event.construction_started","event.operational","event.expansion_operational","event.closed","operator_relationship.roles","observation.capacity_mw","observation.floor_area_sqft"],"updated_at":"2026-09-01T02:30:00Z"},{"canonical_name":"QTS Atlanta Data Center 1","census_region":"South","county_name":"Fulton County","created_at":"2026-09-01T02:30:00Z","facility_id":"fac_im3_building_00269847438","initial_tranche_rank":47,"lifecycle_status":"unknown","national_priority_id":"lnp_im3_d01a351671b0af814f67","national_rank":360,"operator_canonical_name":"Quality Technology Services","operator_id":"opr_im3_8a29e4ffab49b991c1a3","primary_county_fips":"13121","prior_pilot_outcome"